1;Булгаков М.А.;Морфий;1926;263;старое;грустная и трагическая история морфиниста
2;Пушкин А.С.;Капитанская дочка;1836;307;новое;история любви, преданности и верности главных героев
3;Паланик Ч.М.;Бойцовский клуб;1996;311;старое;белый воротничок с раздвоением личности и тягой к самораз­рушению создаёт Бойцовские клубы
4;Андреев Л.Н.;Большой шлем;1899;199;старое;на протяжении нескольких лет группа людей играют в карты
5;Уэлс Г.Д;Человек-невидимка;1897;184;старое;учённый использует свою невидимость во вред человечеству
;;;;;;
